{
  "module": "module_4_process_breakdown",
  "status": "completed",
  "source_decision": {
    "classification": "conditionally_suitable",
    "confidence": "medium_high"
  },
  "breakdown_depth": "business_process_cards_with_candidate_capabilities",
  "process_cards": [
    {
      "step_id": "S01",
      "step_name": "Prepare report scope",
      "business_purpose": "Confirm the date, platform-store scope, and target report template before data collection starts.",
      "input": ["report date definition", "platform-store list", "Tencent Docs daily report template"],
      "operation_summary": "Load the fixed platform-store list, date scope, and report template configuration.",
      "output": ["execution scope", "target template position"],
      "candidate_yingdao_capabilities": ["configuration reading", "Excel or table reading"],
      "depends_on": [],
      "prework_dependencies": ["Confirm the platform-store list is fixed and complete.", "Confirm the report date definition."],
      "handoff_to_exception_design": false,
      "exception_design_notes": []
    },
    {
      "step_id": "S02",
      "step_name": "Enter platform accounts",
      "business_purpose": "Prepare access to each e-commerce platform backend.",
      "input": ["platform account permissions", "login strategy"],
      "operation_summary": "Open or connect to each platform backend using the configured account access method.",
      "output": ["available platform sessions"],
      "candidate_yingdao_capabilities": ["web automation", "login", "browser control"],
      "depends_on": ["S01"],
      "prework_dependencies": ["Confirm the login method for each platform account is stable and reusable."],
      "handoff_to_exception_design": true,
      "exception_design_notes": ["login failure", "captcha or device verification", "permission missing"]
    },
    {
      "step_id": "S03",
      "step_name": "Collect platform daily data",
      "business_purpose": "Get the daily operating metrics for each platform and fixed store.",
      "input": ["platform-store list", "date scope", "account permissions"],
      "operation_summary": "Enter each platform backend and query or download the daily data under fixed conditions.",
      "output": ["raw platform daily data"],
      "candidate_yingdao_capabilities": ["web automation", "report download", "file reading"],
      "depends_on": ["S01", "S02"],
      "prework_dependencies": ["Confirm the platform-store list.", "Confirm the stable login strategy."],
      "handoff_to_exception_design": true,
      "exception_design_notes": ["login failure", "missing data", "download failure"]
    },
    {
      "step_id": "S04",
      "step_name": "Normalize metrics",
      "business_purpose": "Convert platform data into the same report field structure.",
      "input": ["raw platform daily data", "metric mapping rules"],
      "operation_summary": "Map platform fields to report fields and calculate the values needed for the daily report.",
      "output": ["normalized report data"],
      "candidate_yingdao_capabilities": ["data processing", "Excel processing", "condition judgment"],
      "depends_on": ["S03"],
      "prework_dependencies": ["Confirm the metric mapping between platform fields and the report template is complete."],
      "handoff_to_exception_design": true,
      "exception_design_notes": ["missing field", "metric definition mismatch", "empty value"]
    },
    {
      "step_id": "S05",
      "step_name": "Write Tencent Docs report",
      "business_purpose": "Write normalized daily data into the fixed Tencent Docs report template.",
      "input": ["normalized report data", "Tencent Docs template position"],
      "operation_summary": "Open the target Tencent Docs template and write each platform-store metric into the configured position.",
      "output": ["updated Tencent Docs daily report"],
      "candidate_yingdao_capabilities": ["web automation", "online document editing", "table writing"],
      "depends_on": ["S04"],
      "prework_dependencies": ["Confirm the Tencent Docs template location and edit permissions."],
      "handoff_to_exception_design": true,
      "exception_design_notes": ["write failure", "template changed", "permission missing"]
    },
    {
      "step_id": "S06",
      "step_name": "Record execution result",
      "business_purpose": "Preserve evidence for whether the report was generated correctly.",
      "input": ["source values", "written values", "execution status"],
      "operation_summary": "Record source value, written value, processing time, and abnormal items for later review.",
      "output": ["execution log", "manual review list"],
      "candidate_yingdao_capabilities": ["logging", "Excel writing", "notification"],
      "depends_on": ["S05"],
      "prework_dependencies": ["Confirm the minimum result validation method."],
      "handoff_to_exception_design": true,
      "exception_design_notes": ["source-write mismatch", "manual review required"]
    }
  ],
  "assumptions": [
    "Each platform account can reach the daily report view without a new approval step during normal runs.",
    "The Tencent Docs template structure stays stable during the reporting period.",
    "Store ownership and platform-store mapping do not change inside a single reporting cycle."
  ],
  "validation_points": [
    "Confirm the date scope matches the business definition used by every platform before collection starts.",
    "Confirm the platform metric fields map cleanly into the Tencent Docs template before normalization.",
    "Confirm the final written values are compared against source totals or spot checks before sign-off."
  ],
  "cross_step_dependencies": [
    "Platform-store list must be fixed and complete.",
    "Metric-to-template mapping must be confirmed before normalization.",
    "Date scope must be agreed before collection.",
    "Stable login strategy is required for platform collection.",
    "Result log must preserve source values and written values."
  ],
  "open_questions": [],
  "handoff_to_exception_design": {
    "required": true,
    "focus_steps": ["S02", "S03", "S04", "S05", "S06"],
    "notes": ["Design login, missing data, template change, write failure, and source-write mismatch branches."]
  },
  "next_stage_recommendation": "exception_design"
}
